{
  "schema_version": "1.2",
  "id": "TC-006",
  "title": "Submit a draft order",
  "status": "READY",
  "priority": "HIGH",
  "type": "FUNCTIONAL",
  "objective": "Confirm the valid transition from DRAFT to SUBMITTED.",
  "requirement_refs": ["REQ-003"],
  "scenario_refs": ["SCN-006"],
  "coverage_point_refs": ["CP-010", "CP-011"],
  "source_refs": [
    {"source": "examples/requirements.md", "reference": "ORD-003"},
    {"source": "examples/selected-source/order_service.py", "reference": "submit_order"}
  ],
  "preconditions": ["A synthetic order exists in DRAFT state."],
  "test_data": [{"name": "draft order", "description": "A synthetic order currently shown in DRAFT state."}],
  "steps": [
    {"step": 1, "action": "Submit the DRAFT order.", "expected_result": "The order is submitted and its state changes to SUBMITTED.", "needs_clarification": false}
  ],
  "postconditions": ["The synthetic order is in SUBMITTED state."],
  "cleanup": ["Remove the synthetic order using an approved test-environment procedure."],
  "tags": ["order", "submit", "state-transition"],
  "notes": ["Selected implementation evidence sets PROCESSING, which diverges from the authoritative SUBMITTED result. The expected result remains based on ORD-003."]
}
