{
  "schema_version": "1.2",
  "id": "TC-004",
  "title": "Reject a quantity below the minimum",
  "status": "READY",
  "priority": "MEDIUM",
  "type": "FUNCTIONAL",
  "objective": "Confirm that a quantity immediately below the permitted range is rejected without changing the existing quantity.",
  "requirement_refs": ["REQ-002"],
  "scenario_refs": ["SCN-004"],
  "coverage_point_refs": ["CP-006", "CP-007"],
  "source_refs": [{"source": "examples/requirements.md", "reference": "ORD-002"}],
  "preconditions": ["A synthetic DRAFT order line has an existing quantity of 5."],
  "test_data": [{"name": "quantity", "description": "Below-minimum integer quantity: 0."}],
  "steps": [
    {"step": 1, "action": "Set the order-line quantity to 0 and submit the change.", "expected_result": "The value is rejected and the existing quantity remains 5.", "needs_clarification": false}
  ],
  "postconditions": ["The order-line quantity remains 5."],
  "cleanup": ["Remove the synthetic order."],
  "tags": ["order", "quantity", "boundary", "negative"],
  "notes": ["No rejection message is asserted because ORD-002 does not specify one."]
}
